### ISSUE TITLE
Login page in French

### ISSUE THREAD

**Issue by jereviikari** [dbarzin/mercator#535]
Documentation does not tell what is default username and password.
Login page is also only in French.

**Comment by dbarzin** [comment]
Username and password are documented here : https://github.com/dbarzin/mercator/blob/master/INSTALL.md#start

![image](https://github.com/dbarzin/mercator/assets/43208232/ac73bf61-f7b9-4ceb-a9f8-63e80cf08e98)

Login page will be in English shortly.

**Comment by dbarzin** [comment]
The login page uses the internationalization framework.
If you tell your browser that you prefer English to French you will get it in English.

**Comment by jereviikari** [comment]
> The login page uses the internationalization framework. If you tell your browser that you prefer English to French you will get it in English.

I run it on Ubuntu 23.10:
docker pull ghcr.io/dbarzin/mercator:latest
docker run -it --rm --name mercator -e APP_ENV=development -p "127.0.0.1:8000":80 ghcr.io/dbarzin/mercator:latest

Browser is Firefox 119.0+build2-0ubuntu0.23.10.1~mt1
and preferred language: English (United States) [en-us]
Neither English [en] change the page language.

**Comment by dbarzin** [comment]
Strange, it is configured to fallback to English here https://github.com/dbarzin/mercator/blob/master/config/app.php
as described in the documentation of Laravel : https://laravel.com/docs/10.x/localization
I have to check.

**Comment by jereviikari** [comment]
Preferred language was sent properly:

```
Internet Protocol Version 4, Src: 127.0.0.1, Dst: 127.0.0.1
Transmission Control Protocol, Src Port: 39914, Dst Port: 8000, Seq: 1, Ack: 1, Len: 1172
Hypertext Transfer Protocol
    GET /login HTTP/1.1\r\n
    Host: 127.0.0.1:8000\r\n
    User-Agent: Mozilla/5.0 (X11; Ubuntu; Linux x86_64; rv:109.0) Gecko/20100101 Firefox/119.0\r\n
    Accept: text/html,application/xhtml+xml,application/xml;q=0.9,image/avif,image/webp,*/*;q=0.8\r\n
    **Accept-Language: en-US,en;q=0.5\r\n**
    Accept-Encoding: gzip, deflate, br\r\n
    Connection: keep-alive\r\n
```

**Comment by dbarzin** [comment]
Fixed here : https://github.com/dbarzin/mercator/pull/537/files

**Comment by jereviikari** [comment]
> Fixed here : https://github.com/dbarzin/mercator/pull/537/files

The change is effective, but it only applies to the login page. After signing in, most of the elements are still in French, but a few of them are in English.

If the browser's preferred language is set to French, the login page consistently displays in English.

When the browser's preferred language is adjusted on-the-fly, the changes are not immediately reflected; a service restart is required to apply the language settings. This issue appears to be relatively minor. I tied only once.

Upon initial inspection, I was unable to locate a logout option. If one exists, it could benefit from being more prominently displayed, perhaps in the top-right corner.

While I have limited familiarity with Laravel, the configurations appear to be correct, based on the assistance provided by ChatGPT.

For a dependable language change, it is recommended to adjust the settings in Mercator's Preferences -> Options.

**Comment by dbarzin** [comment]
After login the application uses the user's preferred language accessible from Preferences -> Options.

The support for HTTP preferred language is no implemented. I am not sure it is useful for the moment.

The logout link is on the bottom left of the screen : 
![image](https://github.com/dbarzin/mercator/assets/43208232/45e07738-102e-4179-89c7-ab5c4ffd5dab)

Thanks !
